{
  "schema": "gate/1",
  "id": "g1",
  "kind": "advice",
  "status": "approved",
  "text": "advice-brief.md",
  "sha256": "a6639aa809815d9195d5dc4502b23ce306ec7ebc6d0489e7cea61a8f32bfcbd9",
  "bytes": 92,
  "price": {
    "ceiling_usd": 0.75,
    "expected_usd": 0.48
  },
  "seats": [
    {
      "lab": "openai",
      "model": "openai/gpt-6.1-sol",
      "retention": "ZDR-tagged by OpenRouter"
    }
  ],
  "sensitivity": {
    "label": "internal",
    "set_by": "operator"
  },
  "masks": {
    "email": 1,
    "path": 2
  },
  "meta_sha256": "b7c95df46236dac466bff80047f34027356d792503e4900009ccfa3f9e398ad9",
  "requested_at": "2026-10-02T12:00:01.000Z",
  "expires_at": "2026-10-02T12:10:01.000Z",
  "answer": {
    "decision": "approved",
    "channel": "cli",
    "actor": "fixture",
    "reason": null,
    "tty": true,
    "at": "2026-10-02T12:00:04.000Z",
    "seq": 2
  },
  "seq": 1
}
