{
  "schema": "gate/1",
  "id": "g2",
  "kind": "contract_amend",
  "status": "approved",
  "text": "contract/amend-r4.md",
  "sha256": "5a9bc3cd3a277a131b621fdd0b2e114c530ea07a22469cb6d0ae27ce7bccb9fb",
  "bytes": 717,
  "price": null,
  "seats": [],
  "sensitivity": null,
  "masks": {},
  "meta_sha256": "88836f5c9b5239016e7dbd01ae08da739c8fe2c93b290f2838c83b0996af9798",
  "requested_at": "2026-10-07T09:00:15.000Z",
  "expires_at": "2026-10-07T10:00:14.000Z",
  "answer": {
    "decision": "approved",
    "channel": "cli",
    "actor": "fixture",
    "reason": null,
    "tty": true,
    "at": "2026-10-07T09:00:18.000Z",
    "seq": 8
  },
  "seq": 7
}
